{
  "apiVersion": "marshal.operator/v1alpha1",
  "kind": "PlanPremortemPreflight",
  "runId": "run-example-01",
  "selectedAdapter": "qoder",
  "sourceHead": "0000000000000000000000000000000000000000",
  "taskSpec": {
    "path": "task-spec.json",
    "digest": "sha256:0000000000000000000000000000000000000000000000000000000000000000"
  },
  "policySnapshot": {
    "path": "policy-snapshot.json",
    "digest": "sha256:0000000000000000000000000000000000000000000000000000000000000000"
  }
}
